{
  "name": "Fingerprint Dedup Backfill",
  "description": "Backfill content fingerprints on existing thoughts and safely remove duplicates discovered during the process.",
  "category": "recipes",
  "author": {
    "name": "Alan Shurafa",
    "github": "alanshurafa"
  },
  "version": "1.0.0",
  "requires": {
    "open_brain": true,
    "services": [],
    "tools": ["Node.js 18+"]
  },
  "tags": ["deduplication", "fingerprint", "backfill", "data-quality", "cleanup"],
  "difficulty": "beginner",
  "estimated_time": "15 minutes",
  "created": "2026-03-22",
  "updated": "2026-03-22"
}
