{
  "name": "Live Retrieval",
  "description": "Automatically surfaces relevant Open Brain thoughts during active work. Searches when topic shifts are detected, shows brief context notes on hits, stays silent on misses. The read side of the flywheel.",
  "category": "recipes",
  "author": {
    "name": "Jared Irish",
    "github": "jaredirish"
  },
  "version": "1.0.0",
  "requires": {
    "open_brain": true,
    "services": [],
    "tools": ["Claude Code"]
  },
  "tags": ["retrieval", "context", "search", "live", "read", "flywheel", "proactive"],
  "difficulty": "beginner",
  "estimated_time": "5 minutes",
  "created": "2026-03-19",
  "updated": "2026-03-19"
}
