{
  "name": "Google Activity Import",
  "description": "Import your Google Search, Gmail, Maps, YouTube, and Chrome history from Google Takeout into Open Brain as searchable thoughts.",
  "category": "recipes",
  "author": {
    "name": "Alan Shurafa",
    "github": "alanshurafa"
  },
  "version": "1.0.0",
  "requires": {
    "open_brain": true,
    "services": ["OpenRouter"],
    "tools": ["Node.js 18+"]
  },
  "tags": ["google", "takeout", "import", "search-history", "gmail", "maps", "youtube", "chrome", "activity"],
  "difficulty": "beginner",
  "estimated_time": "15 minutes",
  "created": "2026-03-16",
  "updated": "2026-03-16"
}
