{
  "name": "Claudeception",
  "description": "Continuous learning system that extracts reusable knowledge from work sessions and creates new skills. Skills that create other skills. Integrates with Open Brain to search for existing knowledge before creating and capture new skills after.",
  "category": "recipes",
  "author": {
    "name": "Jared Irish",
    "github": "jaredirish"
  },
  "version": "1.0.0",
  "requires": {
    "open_brain": true,
    "services": [],
    "tools": ["Claude Code"]
  },
  "tags": ["skills", "learning", "extraction", "meta", "self-improving", "knowledge", "continuous-learning"],
  "difficulty": "intermediate",
  "estimated_time": "10 minutes",
  "created": "2026-03-19",
  "updated": "2026-03-19"
}
