{
  "name": "Obsidian Vault Import",
  "description": "Parse your Obsidian vault and import notes into Open Brain as searchable, embedded thoughts with full metadata.",
  "category": "recipes",
  "author": {
    "name": "Sam Rogers",
    "github": "snapsynapse"
  },
  "version": "1.0.0",
  "requires": {
    "open_brain": true,
    "services": ["OpenRouter"],
    "tools": ["Python 3.10+"]
  },
  "tags": ["obsidian", "import", "migration", "vault", "markdown", "pkm"],
  "difficulty": "intermediate",
  "estimated_time": "20 minutes setup + ~16 min per 1000 thoughts",
  "created": "2026-03-13",
  "updated": "2026-03-23"
}
