{
  "name": "Instagram Import",
  "description": "Import Instagram data exports — DM conversations, comments, and post captions — into Open Brain as searchable thoughts.",
  "category": "recipes",
  "author": {
    "name": "Alan Shurafa",
    "github": "alanshurafa"
  },
  "version": "1.0.0",
  "requires": {
    "open_brain": true,
    "services": ["OpenRouter API", "Supabase"],
    "tools": ["Node.js 18+"]
  },
  "tags": ["import", "instagram", "meta", "social-media", "messages"],
  "difficulty": "intermediate",
  "estimated_time": "20 minutes",
  "created": "2026-03-15",
  "updated": "2026-03-15"
}
