{
  "name": "X/Twitter Import",
  "description": "Import X (Twitter) data exports — tweets, DMs, and Grok chats — into Open Brain as searchable thoughts.",
  "category": "recipes",
  "author": {
    "name": "Alan Shurafa",
    "github": "alanshurafa"
  },
  "version": "1.0.0",
  "requires": {
    "open_brain": true,
    "services": ["OpenRouter API", "Supabase"],
    "tools": ["Node.js 18+"]
  },
  "tags": ["import", "twitter", "x", "tweets", "social-media"],
  "difficulty": "intermediate",
  "estimated_time": "20 minutes",
  "created": "2026-03-15",
  "updated": "2026-03-15"
}
